{
  "schema_version": "region-talk-ydb-bloggers-quarantine-receipt.v1",
  "request_id": "11111111-1111-4111-8111-111111111111",
  "operation_id": "22222222-2222-4222-8222-222222222222",
  "request_sha256": "aaaaaaaaaaaaaaaaaaaaaaaaaaaaaaaaaaaaaaaaaaaaaaaaaaaaaaaaaaaaaaaa",
  "master_instance_id": "33333333-3333-4333-8333-333333333333",
  "run_id": "owner/blogger-master-run",
  "attempt_id": "attempt-1",
  "epoch": 7,
  "export_batch_id": "44444444-4444-4444-8444-444444444444",
  "failure_code": "BloggerMigrationQuarantined",
  "row_count": 266,
  "raw_count": 266,
  "dispositioned_count": 266,
  "undispositioned_count": 0,
  "quarantined_count": 2,
  "logical_sha256": "bbbbbbbbbbbbbbbbbbbbbbbbbbbbbbbbbbbbbbbbbbbbbbbbbbbbbbbbbbbbbbbb",
  "record_id_set_sha256": "cccccccccccccccccccccccccccccccccccccccccccccccccccccccccccccccc",
  "canonical_outcome_sha256": "dddddddddddddddddddddddddddddddddddddddddddddddddddddddddddddddd",
  "duplicate_group_count": 1,
  "duplicate_groups_pending": 1,
  "duplicate_review_inputs": {
    "groups": [
      {
        "identity_sha256": "eeeeeeeeeeeeeeeeeeeeeeeeeeeeeeeeeeeeeeeeeeeeeeeeeeeeeeeeeeeeeeee",
        "members": [
          {
            "record_id": "record-001",
            "projected_actor_id": "55555555-5555-4555-8555-555555555551"
          },
          {
            "record_id": "record-002",
            "projected_actor_id": "55555555-5555-4555-8555-555555555552"
          }
        ],
        "existing_actor_id": null
      }
    ]
  },
  "transaction_committed": true,
  "durability_state": "BLOCKED_QUARANTINE"
}
